{
  "dependencies": [
    "Microsoft.Extensions.Configuration.Abstractions/10.0.13",
    "Microsoft.Extensions.Configuration.Binder/10.0.13",
    "Microsoft.Extensions.Configuration.CommandLine/10.0.13",
    "Microsoft.Extensions.Configuration.EnvironmentVariables/10.0.13",
    "Microsoft.Extensions.Configuration.FileExtensions/10.0.13",
    "Microsoft.Extensions.Configuration.Json/10.0.13",
    "Microsoft.Extensions.Configuration.UserSecrets/10.0.13",
    "Microsoft.Extensions.Configuration/10.0.13",
    "Microsoft.Extensions.DependencyInjection.Abstractions/10.0.13",
    "Microsoft.Extensions.DependencyInjection/10.0.13",
    "Microsoft.Extensions.Diagnostics.Abstractions/10.0.13",
    "Microsoft.Extensions.Diagnostics/10.0.13",
    "Microsoft.Extensions.FileProviders.Abstractions/10.0.13",
    "Microsoft.Extensions.FileProviders.Physical/10.0.13",
    "Microsoft.Extensions.FileSystemGlobbing/10.0.13",
    "Microsoft.Extensions.Hosting.Abstractions/10.0.13",
    "Microsoft.Extensions.Hosting/10.0.13",
    "Microsoft.Extensions.Logging.Abstractions/10.0.13",
    "Microsoft.Extensions.Logging.Configuration/10.0.13",
    "Microsoft.Extensions.Logging.Console/10.0.13",
    "Microsoft.Extensions.Logging.Debug/10.0.13",
    "Microsoft.Extensions.Logging.EventLog/10.0.13",
    "Microsoft.Extensions.Logging.EventSource/10.0.13",
    "Microsoft.Extensions.Logging/10.0.13",
    "Microsoft.Extensions.Options.ConfigurationExtensions/10.0.13",
    "Microsoft.Extensions.Options/10.0.13",
    "Microsoft.Extensions.Primitives/10.0.13",
    "System.Diagnostics.EventLog/10.0.13"
  ],
  "workloads": [],
  "additionalInputs": [
    "samples/AquariumImport/AquariumChecks.cs",
    "samples/net11.0/AquariumImport/AquariumWorker.cs",
    "samples/net11.0/AquariumImport/AquariumSetup.cs",
    "eng/Record-Evidence.ps1",
    "eng/Evidence.ps1",
    "eng/Record-CalibrationHost.ps1",
    "samples/net11.0/AquariumImport/AquariumDemo.cs"
  ],
  "buildArguments": [],
  "nativeToolchains": []
}
