{
  "workloads": [],
  "nativeToolchains": [
    "MSVC/14.51.36231",
    "WindowsSDK/10.0.26100.0",
    "ILCompiler/11.0.0-rc.2.26504.105"
  ],
  "dependencies": [
    "Microsoft.Build.Framework/18.11.0",
    "Microsoft.Build.Utilities.Core/18.11.0",
    "Microsoft.Build/18.11.0",
    "Microsoft.DotNet.ILCompiler/11.0.0-rc.2.26504.105",
    "Microsoft.NET.ILLink.Tasks/11.0.0-rc.2.26504.105",
    "Microsoft.NET.StringTools/18.11.0",
    "Microsoft.VisualStudio.SolutionPersistence/1.0.52",
    "NuGet.Frameworks/7.9.0",
    "runtime.win-x64.Microsoft.DotNet.ILCompiler/11.0.0-rc.2.26504.105",
    "System.Configuration.ConfigurationManager/10.0.10",
    "System.Diagnostics.EventLog/10.0.10",
    "System.Reflection.MetadataLoadContext/10.0.10",
    "System.Security.Cryptography.ProtectedData/10.0.10"
  ],
  "buildArguments": [],
  "additionalInputs": [
    "samples/PermitHost",
    "eng/Record-NorthQuayBuildHost.ps1"
  ]
}
