{
  "nativeToolchains": [],
  "workloads": [],
  "buildArguments": [],
  "additionalInputs": [
    ".editorconfig",
    "eng/Evidence.ps1",
    "eng/Record-Evidence.ps1",
    "eng/QuaysideRoutes.browser.js",
    "samples/net11.0/QuaysideRoutes"
  ],
  "dependencies": [
    "Microsoft.AspNetCore.Authorization/11.0.0-rc.2.26504.105",
    "Microsoft.AspNetCore.Components.Analyzers/11.0.0-rc.2.26504.105",
    "Microsoft.AspNetCore.Components.Forms/11.0.0-rc.2.26504.105",
    "Microsoft.AspNetCore.Components.Web/11.0.0-rc.2.26504.105",
    "Microsoft.AspNetCore.Components.WebAssembly/11.0.0-rc.2.26504.105",
    "Microsoft.AspNetCore.Components/11.0.0-rc.2.26504.105",
    "Microsoft.AspNetCore.Metadata/11.0.0-rc.2.26504.105",
    "Microsoft.Extensions.Configuration.Binder/11.0.0-rc.2.26504.105",
    "Microsoft.Extensions.Configuration.EnvironmentVariables/11.0.0-rc.2.26504.105",
    "Microsoft.Extensions.Configuration.FileExtensions/11.0.0-rc.2.26504.105",
    "Microsoft.Extensions.Configuration.Json/11.0.0-rc.2.26504.105",
    "Microsoft.Extensions.Configuration/11.0.0-rc.2.26504.105",
    "Microsoft.Extensions.DependencyInjection/11.0.0-rc.2.26504.105",
    "Microsoft.Extensions.Diagnostics/11.0.0-rc.2.26504.105",
    "Microsoft.Extensions.Features/10.0.12",
    "Microsoft.Extensions.FileProviders.Physical/11.0.0-rc.2.26504.105",
    "Microsoft.Extensions.FileSystemGlobbing/11.0.0-rc.2.26504.105",
    "Microsoft.Extensions.Http/10.0.12",
    "Microsoft.Extensions.Localization.Abstractions/11.0.0-rc.2.26504.105",
    "Microsoft.Extensions.Logging.Configuration/10.0.0",
    "Microsoft.Extensions.Logging/11.0.0-rc.2.26504.105",
    "Microsoft.Extensions.Options.ConfigurationExtensions/11.0.0-rc.2.26504.105",
    "Microsoft.Extensions.ServiceDiscovery.Abstractions/10.10.0",
    "Microsoft.Extensions.ServiceDiscovery/10.10.0",
    "Microsoft.Extensions.Validation/11.0.0-rc.2.26504.105",
    "Microsoft.JSInterop.WebAssembly/11.0.0-rc.2.26504.105",
    "Microsoft.JSInterop/11.0.0-rc.2.26504.105",
    "OpenTelemetry.Api.ProviderBuilderExtensions/1.19.1",
    "OpenTelemetry.Api/1.19.1",
    "OpenTelemetry.Exporter.OpenTelemetryProtocol/1.19.1",
    "OpenTelemetry.Extensions.Hosting/1.19.1",
    "OpenTelemetry.Instrumentation.Http/1.19.0",
    "OpenTelemetry.Instrumentation.Runtime/1.19.0",
    "OpenTelemetry/1.19.1"
  ]
}
