{
  "dependencies": [
    "Microsoft.Bcl.Cryptography/9.0.18",
    "Microsoft.Data.SqlClient.Extensions.Abstractions/7.1.0",
    "Microsoft.Data.SqlClient.Internal.Logging/7.1.0",
    "Microsoft.Data.SqlClient.SNI.runtime/7.1.0",
    "Microsoft.Data.SqlClient/7.1.0",
    "Microsoft.EntityFrameworkCore.Abstractions/11.0.0-rc.2.26504.105",
    "Microsoft.EntityFrameworkCore.Analyzers/11.0.0-rc.2.26504.105",
    "Microsoft.EntityFrameworkCore.Relational/11.0.0-rc.2.26504.105",
    "Microsoft.EntityFrameworkCore.SqlServer/11.0.0-rc.2.26504.105",
    "Microsoft.EntityFrameworkCore/11.0.0-rc.2.26504.105",
    "Microsoft.Extensions.Caching.Memory/11.0.0-rc.2.26504.105",
    "Microsoft.Extensions.DependencyInjection/11.0.0-rc.2.26504.105",
    "Microsoft.Extensions.Logging/11.0.0-rc.2.26504.105",
    "Microsoft.IdentityModel.Abstractions/8.16.0",
    "Microsoft.IdentityModel.JsonWebTokens/8.16.0",
    "Microsoft.IdentityModel.Logging/8.16.0",
    "Microsoft.IdentityModel.Protocols.OpenIdConnect/8.16.0",
    "Microsoft.IdentityModel.Protocols/8.16.0",
    "Microsoft.IdentityModel.Tokens/8.16.0",
    "Microsoft.SqlServer.Server/1.0.0",
    "System.Configuration.ConfigurationManager/9.0.18",
    "System.Diagnostics.EventLog/9.0.18",
    "System.IdentityModel.Tokens.Jwt/8.16.0",
    "System.Security.Cryptography.Pkcs/10.0.13",
    "System.Security.Cryptography.ProtectedData/9.0.18",
    "System.Threading.RateLimiting/9.0.18"
  ],
  "workloads": [],
  "additionalInputs": [
    "eng/Evidence.ps1",
    "eng/Record-Evidence.ps1"
  ],
  "buildArguments": [],
  "nativeToolchains": []
}
