{
  "dependencies": [
    "Microsoft.Data.Sqlite.Core/11.0.0-rc.2.26504.105",
    "Microsoft.Data.Sqlite/11.0.0-rc.2.26504.105",
    "SQLite/3.53.4",
    "SQLitePCLRaw.bundle_e_sqlite3/3.0.5",
    "SQLitePCLRaw.config.e_sqlite3/3.0.5",
    "SQLitePCLRaw.core/3.0.5",
    "SQLitePCLRaw.provider.e_sqlite3/3.0.5"
  ],
  "workloads": [],
  "additionalInputs": [
    "eng/Evidence.ps1",
    "eng/Record-Evidence.ps1"
  ],
  "buildArguments": [],
  "nativeToolchains": []
}
