{
  "dependencies": [
    "Microsoft.Extensions.Caching.Abstractions/10.0.13",
    "Microsoft.Extensions.Configuration.Abstractions/10.0.13",
    "Microsoft.Extensions.DependencyInjection.Abstractions/10.0.13",
    "Microsoft.Extensions.Diagnostics.Abstractions/10.0.13",
    "Microsoft.Extensions.FileProviders.Abstractions/10.0.13",
    "Microsoft.Extensions.Hosting.Abstractions/10.0.13",
    "Microsoft.Extensions.Logging.Abstractions/10.0.13",
    "Microsoft.Extensions.Options/10.0.13",
    "Microsoft.Extensions.Primitives/10.0.13"
  ],
  "additionalInputs": [
    "samples/ExtensionIdentity/PlanetariumChecks.cs",
    "samples/NetworkBuffers/RuntimeIdentity.cs",
    "eng/Record-Evidence.ps1",
    "eng/Evidence.ps1",
    "eng/Test-ExtensionIdentity.ps1",
    ".editorconfig",
    "docs/planning/audits/extension-identity.sources.json",
    "docs/planning/audits/extensions.assets.json",
    "samples/ExtensionIdentity/Library",
    "samples/ExtensionIdentity/Consumer",
    "samples/ExtensionIdentity/Override",
    "samples/ExtensionIdentity/Implementation"
  ],
  "workloads": [],
  "buildArguments": [],
  "nativeToolchains": []
}
