{
  "dependencies": [
    "Microsoft.Bcl.AsyncInterfaces/10.0.11",
    "Microsoft.Extensions.DependencyInjection.Abstractions/10.0.11",
    "Microsoft.Extensions.Logging.Abstractions/10.0.11",
    "Microsoft.NETCore.Platforms/1.1.0",
    "Microsoft.TemplateEngine.Abstractions/10.0.402",
    "Microsoft.TemplateEngine.Core.Contracts/10.0.402",
    "Microsoft.TemplateEngine.Core/10.0.402",
    "Microsoft.TemplateEngine.Edge/10.0.402",
    "Microsoft.TemplateEngine.Orchestrator.RunnableProjects/10.0.402",
    "Microsoft.TemplateEngine.Utils/10.0.402",
    "NETStandard.Library/2.0.3",
    "Newtonsoft.Json/13.0.3",
    "NuGet.Common/6.13.2",
    "NuGet.Configuration/6.13.2",
    "NuGet.Credentials/6.13.2",
    "NuGet.Frameworks/6.13.2",
    "NuGet.Packaging/6.13.2",
    "NuGet.Protocol/6.13.2",
    "NuGet.Versioning/6.13.2",
    "System.Buffers/4.6.1",
    "System.Collections.Immutable/8.0.0",
    "System.Diagnostics.DiagnosticSource/10.0.11",
    "System.Formats.Asn1/10.0.11",
    "System.IO.Pipelines/10.0.11",
    "System.Memory/4.6.3",
    "System.Numerics.Vectors/4.6.1",
    "System.Runtime.CompilerServices.Unsafe/6.1.2",
    "System.Security.Cryptography.Cng/5.0.0",
    "System.Security.Cryptography.Pkcs/6.0.4",
    "System.Security.Cryptography.ProtectedData/4.4.0",
    "System.Text.Encodings.Web/10.0.11",
    "System.Text.Json/10.0.11",
    "System.Threading.Tasks.Extensions/4.6.3"
  ],
  "nativeToolchains": [],
  "additionalInputs": [
    "samples/ArchiveTemplate",
    "eng/Evidence.ps1",
    "eng/Record-Evidence.ps1",
    "eng/Test-TemplateEngineHost.ps1",
    "docs/planning/audits/sdk-package-hosts.sources.json",
    "docs/planning/audits/sdk-package-hosts.assets.json",
    ".editorconfig"
  ],
  "workloads": [],
  "buildArguments": []
}
