{
  "dependencies": [
    "Microsoft.AspNetCore.App.Internal.Assets/10.0.13"
  ],
  "workloads": [],
  "buildArguments": [],
  "nativeToolchains": [],
  "additionalInputs": [
    "eng/Record-Evidence.ps1",
    "eng/Evidence.ps1",
    ".editorconfig",
    "eng/Test-RemovedBlazorConsumers.mjs",
    "eng/Record-RemovedBlazorBehavior.ps1"
  ]
}
