{
  "workloads": [],
  "dependencies": [
    "Microsoft.DotNet.ILCompiler/10.0.13",
    "Microsoft.NET.ILLink.Tasks/10.0.13",
    "runtime.win-x64.Microsoft.DotNet.ILCompiler/10.0.13"
  ],
  "additionalInputs": [
    "eng/Evidence.ps1",
    "eng/EstuaryProof.ps1",
    "eng/Test-EstuaryWindows.ps1",
    "samples/EstuarySdk/artifacts.json",
    "samples/EstuarySdk/BinlogReader"
  ],
  "nativeToolchains": [
    "MSVC-link/14.51.36260.0",
    "Windows-SDK/10.0.26100.0"
  ],
  "buildArguments": []
}
