{
  "additionalInputs": [
    "eng/Record-Evidence.ps1",
    "eng/Evidence.ps1",
    "eng/Test-WebTooling.ps1"
  ],
  "buildArguments": [],
  "dependencies": [
    "Microsoft.AspNetCore.Authentication.JwtBearer/11.0.0-rc.2.26504.105",
    "Microsoft.Bcl.Cryptography/10.0.2",
    "Microsoft.IdentityModel.Abstractions/8.19.2",
    "Microsoft.IdentityModel.JsonWebTokens/8.19.2",
    "Microsoft.IdentityModel.Logging/8.19.2",
    "Microsoft.IdentityModel.Protocols.OpenIdConnect/8.19.2",
    "Microsoft.IdentityModel.Protocols/8.19.2",
    "Microsoft.IdentityModel.Tokens/8.19.2",
    "System.IdentityModel.Tokens.Jwt/8.19.2"
  ],
  "workloads": [],
  "nativeToolchains": []
}
