{
  "additionalInputs": [
    ".editorconfig",
    "eng/Record-Evidence.ps1",
    "eng/Evidence.ps1",
    "eng/Record-ComponentActions.ps1",
    "eng/Test-ComponentActions.mjs"
  ],
  "dependencies": [
    "Microsoft.AspNetCore.App.Internal.Assets/11.0.0-rc.2.26504.105"
  ],
  "nativeToolchains": [],
  "workloads": [],
  "buildArguments": []
}
