{
  "workloads": [],
  "buildArguments": [],
  "dependencies": [
    "Microsoft.TestPlatform.ObjectModel/18.11.0",
    "Microsoft.TestPlatform.TestHost/18.11.0"
  ],
  "additionalInputs": [
    "samples/LaboratoryMessages/LabRun.cs",
    "samples/LaboratoryMessages/TypedBridge.cs",
    "samples/LaboratoryMessages/LegacyReader.cs",
    "samples/LaboratoryMessages/SurfaceChecks.cs",
    "samples/LaboratoryMessages/Program.cs",
    "eng/Evidence.ps1",
    "eng/Test-VSTestMessages.ps1",
    "docs/planning/audits/sdk-package-hosts.assets.json",
    "docs/planning/audits/sdk-package-hosts.sources.json"
  ],
  "nativeToolchains": []
}
